b'7.1 km',b'3.8 (715 Ratings)\xc2\xb7Good',b'\xe2\x82\xb9926\xe2\x82\xb9',"b'Sector 6, HSR Layout, Bangalore\xc2\xb7\n\n\n\n\n\n\n7.1 km'"
b'2.7 km',b'NEW',b'\xe2\x82\xb9912\xe2\x82\xb9',"b'Near Majestic, Nagarathpete, Bangalore\xc2\xb7\n\n\n\n\n\n\n2.7 km'"
b'6.2 km',b'3.7 (63 Ratings)\xc2\xb7Good',b'\xe2\x82\xb9973\xe2\x82\xb9',"b'Near Shantiniketan Educational Institute, BTM Layout, Bnagalore\xc2\xb7\n\n\n\n\n\n\n6.2 km'"
b'5.5 km',b'NEW',b'\xe2\x82\xb91014',"b'Near Sri Balaji medicals, Zuzuvadi, Bangalore\xc2\xb7\n\n\n\n\n\n\n5.5 km'"
b'6.4 km',b'4.7 (910 Ratings)\xc2\xb7Excellent',b'\xe2\x82\xb9920\xe2\x82\xb9',"b'Near Krishna Leela Grand Hotel, Vsv Avenue, Bangalore\xc2\xb7\n\n\n\n\n\n\n6.4 km'"
b'4.8 km',b'3.8 (795 Ratings)\xc2\xb7Good',b'\xe2\x82\xb91302',"b'Near SR Krishnappa Garden, Swagath Road, Bangalore\xc2\xb7\n\n\n\n\n\n\n4.8 km'"
b'4.9 km',b'4.4 (23 Ratings)\xc2\xb7Very Good',b'\xe2\x82\xb9926\xe2\x82\xb9',"b'Near Clove Dental Clinic, Domlur, Bangalore\xc2\xb7\n\n\n\n\n\n\n4.9 km'"
b'5.6 km',b'4.6 (824 Ratings)\xc2\xb7Excellent',b'\xe2\x82\xb91539',"b'Near Domlur Bridge, Indiranagar, Bangalore\xc2\xb7\n\n\n\n\n\n\n5.6 km'"
b'3.2 km',b'4.6 (750 Ratings)\xc2\xb7Excellent',b'\xe2\x82\xb91727',"b'Near Mantri Square Mall, Sheshadripuram, Bangalore\xc2\xb7\n\n\n\n\n\n\n3.2 km'"
b'5.4 km',b'4.7 (1212 Ratings)\xc2\xb7Excellent',b'\xe2\x82\xb91285',"b'Near IIFT, Vijayanagar, Bangalore\xc2\xb7\n\n\n\n\n\n\n5.4 km'"
b'4.8 km',b'3.8 (1193 Ratings)\xc2\xb7Good',b'\xe2\x82\xb91292',"b'Near Sagar Hospital, Hombegowda Nagar, Bangalore\xc2\xb7\n\n\n\n\n\n\n4.8 km'"
b'7.3 km',b'4.6 (485 Ratings)\xc2\xb7Excellent',b'\xe2\x82\xb91565',"b'Near Yeshwantpur Station, Bangalore\xc2\xb7\n\n\n\n\n\n\n7.3 km'"
b'3.4 km',b'3.8 (55 Ratings)\xc2\xb7Good',b'\xe2\x82\xb91320',"b'Near Mariyappa Road, Jayanagar Ward, Bangalore\xc2\xb7\n\n\n\n\n\n\n3.4 km'"
b'5.0 km',b'4.2 (364 Ratings)\xc2\xb7Very Good',b'\xe2\x82\xb9967\xe2\x82\xb9',"b'Near MSO Colony, Maruthi Seva Nagar, Bangalore\xc2\xb7\n\n\n\n\n\n\n5.0 km'"
b'9.3 km',b'4.2 (231 Ratings)\xc2\xb7Very Good',b'\xe2\x82\xb91310',"b'Near manjunatha medicals, Hebbal Kempapura, Bangalore\xc2\xb7\n\n\n\n\n\n\n9.3 km'"
b'9.3 km',b'NEW',b'\xe2\x82\xb91014',"b'Dasarahalli, Bangalore\xc2\xb7\n\n\n\n\n\n\n9.3 km'"
b'6.3 km',b'4.4 (265 Ratings)\xc2\xb7Very Good',b'\xe2\x82\xb91351',"b'Near Gopalan Innovation Mall, BHBCS Layout, Bangalore\xc2\xb7\n\n\n\n\n\n\n6.3 km'"
b'6.2 km',b'4.4 (1628 Ratings)\xc2\xb7Very Good',b'\xe2\x82\xb91360',"b'Near Perseverance HBR, Saint Thomas Town, Bangalore\xc2\xb7\n\n\n\n\n\n\n6.2 km'"
b'4.2 km',b'3.9 (376 Ratings)\xc2\xb7Good',b'\xe2\x82\xb91381',"b'Near DAD Quarters,Ulsoor, Bangalore\xc2\xb7\n\n\n\n\n\n\n4.2 km'"
b'4.7 km',b'NEW',b'\xe2\x82\xb92148',"b'Near 14th Main Road, Rajaji Nagar, Bangalore\xc2\xb7\n\n\n\n\n\n\n4.7 km'"
b'2.6 km',b'3.9 (316 Ratings)\xc2\xb7Good',b'\xe2\x82\xb9628\xe2\x82\xb9',"b'Near Cotton Pete Police Station, Bangalore\xc2\xb7\n\n\n\n\n\n\n2.6 km'"
b'2.2 km',b'4.3 (484 Ratings)\xc2\xb7Very Good',b'\xe2\x82\xb9949\xe2\x82\xb9',"b'Near Movieland Theatre, RK Puram, Bangalore\xc2\xb7\n\n\n\n\n\n\n2.2 km'"
b'6.4 km',b'4.3 (848 Ratings)\xc2\xb7Very Good',b'\xe2\x82\xb91216',"b'Near Mra Bakery, Nanjundappa Rd, Bangalore\xc2\xb7\n\n\n\n\n\n\n6.4 km'"
b'9.1 km',b'4.1 (817 Ratings)\xc2\xb7Very Good',b'\xe2\x82\xb91014',"b'Near RNS motors, Bannerghatta Road, Bangalore\xc2\xb7\n\n\n\n\n\n\n9.1 km'"
b'5.8 km',b'NEW',b'\xe2\x82\xb91413',"b'Near OYE Amritsar, New Tippasandra, Banglore\xc2\xb7\n\n\n\n\n\n\n5.8 km'"
b'8.0 km',b'4.7 (334 Ratings)\xc2\xb7Excellent',b'\xe2\x82\xb9918\xe2\x82\xb9',"b'Bennigana halli, Kasturi nagar\xc2\xb7\n\n\n\n\n\n\n8.0 km'"
b'5.5 km',b'4.3 (209 Ratings)\xc2\xb7Very Good',b'\xe2\x82\xb91632',"b'Near AVS Layout, Koramangala, Bangalore\xc2\xb7\n\n\n\n\n\n\n5.5 km'"
b'7.9 km',b'4.2 (435 Ratings)\xc2\xb7Very Good',b'\xe2\x82\xb9877\xe2\x82\xb9',"b'Near Manyata Tech Park, HBR Layout, Bangalore\xc2\xb7\n\n\n\n\n\n\n7.9 km'"
b'5.7 km',b'3.9 (922 Ratings)\xc2\xb7Good',b'\xe2\x82\xb91014',"b'Near Bilal masjid, Gurappanapalya, Bangalore\xc2\xb7\n\n\n\n\n\n\n5.7 km'"
b'6.7 km',b'3.5 (3 Ratings)\xc2\xb7Good',b'\xe2\x82\xb91327',"b'Near Old Airport Road, Bangalore\xc2\xb7\n\n\n\n\n\n\n6.7 km'"
b'6.2 km',b'4.6 (831 Ratings)\xc2\xb7Excellent',b'\xe2\x82\xb91319',"b'Near Sarvodaya College of Nursing, Magadi Rd, Bangalore\xc2\xb7\n\n\n\n\n\n\n6.2 km'"
b'6.2 km',b'NEW',b'\xe2\x82\xb91014',"b'Near KEB Colony, BTM Layout 1, Bangalore\xc2\xb7\n\n\n\n\n\n\n6.2 km'"
b'8.7 km',b'4.1 (504 Ratings)\xc2\xb7Very Good',b'\xe2\x82\xb91255',"b'Near Yesvantpur Junction Railway Station, Bangalore\xc2\xb7\n\n\n\n\n\n\n8.7 km'"
b'7.8 km',b'4.6 (703 Ratings)\xc2\xb7Excellent',b'\xe2\x82\xb91264',"b'Near Allahabad Bank, HRBR Layout, Bangalore\xc2\xb7\n\n\n\n\n\n\n7.8 km'"
b'7.3 km',b'3.8 (369 Ratings)\xc2\xb7Good',b'\xe2\x82\xb91014',"b""Near Teacher's Colony Park, Koramangala, Bangalore\xc2\xb7\n\n\n\n\n\n\n7.3 km"""
b'7.7 km',b'4.2 (634 Ratings)\xc2\xb7Very Good',b'\xe2\x82\xb91479',"b'Near HKBK College, Manyata Tech Park, Bangalore\xc2\xb7\n\n\n\n\n\n\n7.7 km'"
b'7.2 km',b'3.7 (385 Ratings)\xc2\xb7Good',b'\xe2\x82\xb91324',"b'Near NIRM, Kaderanahalli Junction, Bangalore\xc2\xb7\n\n\n\n\n\n\n7.2 km'"
b'4.7 km',b'4.2 (585 Ratings)\xc2\xb7Very Good',b'\xe2\x82\xb9949\xe2\x82\xb9',"b'Near Tata Silk Farm, Jayanagar, Bengaluru\xc2\xb7\n\n\n\n\n\n\n4.7 km'"
b'8.2 km',b'4.3 (1062 Ratings)\xc2\xb7Very Good',b'\xe2\x82\xb91611',"b'Near Big Bazar, Bannerghatta Road, Bangalore\xc2\xb7\n\n\n\n\n\n\n8.2 km'"
b'7.5 km',b'4.5 (653 Ratings)\xc2\xb7Excellent',b'\xe2\x82\xb91998',"b'Near HRBR Layout, Kalyan Nagar, Bengaluru\xc2\xb7\n\n\n\n\n\n\n7.5 km'"
b'7.0 km',b'3.9 (275 Ratings)\xc2\xb7Good',b'\xe2\x82\xb9931\xe2\x82\xb9',"b'Near Yeshwanthpur Railway Station, Bangalore\xc2\xb7\n\n\n\n\n\n\n7.0 km'"
b'6.8 km',b'4.1 (200 Ratings)\xc2\xb7Very Good',b'\xe2\x82\xb91395',"b'Near Kemp Fort Mall, Murugeshpalya, Bangalore\xc2\xb7\n\n\n\n\n\n\n6.8 km'"
b'8.1 km',b'3.5 (63 Ratings)\xc2\xb7Good',b'\xe2\x82\xb91014',"b'Near Hosur Road, Rajiv Gandhi Nagar, Bangalore\xc2\xb7\n\n\n\n\n\n\n8.1 km'"
b'6.0 km',b'4.3 (291 Ratings)\xc2\xb7Very Good',b'\xe2\x82\xb91226',"b'Near Manipal Hospital, Kodihalli, Bangalore\xc2\xb7\n\n\n\n\n\n\n6.0 km'"
b'4.0 km',b'4.6 (478 Ratings)\xc2\xb7Excellent',b'\xe2\x82\xb91914',"b'Near Malleshwaram Police Station, Srirampura, Bangalore\xc2\xb7\n\n\n\n\n\n\n4.0 km'"
b'7.7 km',b'4.3 (941 Ratings)\xc2\xb7Very Good',b'\xe2\x82\xb91014',"b'Near Hennur Bellary Road, Kalyan Nagar, Bangalore\xc2\xb7\n\n\n\n\n\n\n7.7 km'"
b'2.0 km',b'4.2 (237 Ratings)\xc2\xb7Very Good',b'\xe2\x82\xb9700\xe2\x82\xb9',"b'Bangalore Urban, Bangalore\xc2\xb7\n\n\n\n\n\n\n2.0 km'"
b'7.9 km',b'3.7 (431 Ratings)\xc2\xb7Good',b'\xe2\x82\xb91014',"b'Near Big Boys Cars, HRBR Layout, Bangalore\xc2\xb7\n\n\n\n\n\n\n7.9 km'"
b'8.4 km',b'4.4 (324 Ratings)\xc2\xb7Very Good',b'\xe2\x82\xb91486',"b'Near Itsy Bitsy, Sector 3, Bangalore\xc2\xb7\n\n\n\n\n\n\n8.4 km'"
b'7.2 km',b'4.3 (145 Ratings)\xc2\xb7Very Good',b'\xe2\x82\xb91338',"b'Hebbal, Bangalore\xc2\xb7\n\n\n\n\n\n\n7.2 km'"
b'2.6 km',b'3.9 (494 Ratings)\xc2\xb7Good',b'\xe2\x82\xb91014',"b'Near Bank of Baroda ATM, Akkipete, Bangalore\xc2\xb7\n\n\n\n\n\n\n2.6 km'"
b'7.4 km',b'3.6 (511 Ratings)\xc2\xb7Good',b'\xe2\x82\xb91216',"b'Near Mysore RD. Metro Station, FCI Layout, Bangalore\xc2\xb7\n\n\n\n\n\n\n7.4 km'"
b'4.5 km',b'3.7 (453 Ratings)\xc2\xb7Good',b'\xe2\x82\xb91004',"b'Near Forum Mall, Koramangala, Bangalore\xc2\xb7\n\n\n\n\n\n\n4.5 km'"
b'2.0 km',b'NEW',b'\xe2\x82\xb91014',"b'Near Urvashi Theatre, Sudhama Nagar, Bangalore\xc2\xb7\n\n\n\n\n\n\n2.0 km'"
b'7.4 km',b'4.7 (1337 Ratings)\xc2\xb7Excellent',b'\xe2\x82\xb91509',"b'Near NIAS, Mathikere Extension, Bangalore\xc2\xb7\n\n\n\n\n\n\n7.4 km'"
b'6.1 km',b'4.3 (271 Ratings)\xc2\xb7Very Good',b'\xe2\x82\xb91014',"b'Near The Forum Mall, BTM Layout, Bengaluru\xc2\xb7\n\n\n\n\n\n\n6.1 km'"
b'2.3 km',b'4.8 (106 Ratings)\xc2\xb7Excellent',b'\xe2\x82\xb91300',"b'Near Hatti Kappi, Yellappa Garden, Bangalore\xc2\xb7\n\n\n\n\n\n\n2.3 km'"
b'8.1 km',b'3.8 (338 Ratings)\xc2\xb7Good',b'\xe2\x82\xb91735',"b'Near Lumbini Garden, Nagavara, Banglore\xc2\xb7\n\n\n\n\n\n\n8.1 km'"
b'5.4 km',b'3.7 (802 Ratings)\xc2\xb7Good',b'\xe2\x82\xb91014',"b'Near Maruti Nagar, Btm Layout, Bangalore\xc2\xb7\n\n\n\n\n\n\n5.4 km'"
b'6.2 km',b'3.8 (437 Ratings)\xc2\xb7Good',b'\xe2\x82\xb91444',"b'Near CBI Office, Ganganagar, Bangalore\xc2\xb7\n\n\n\n\n\n\n6.2 km'"
b'2.3 km',b'4.3 (61 Ratings)\xc2\xb7Very Good',b'\xe2\x82\xb9910\xe2\x82\xb9',"b'Near Kr Market Metro, Vaisakhi Buildings, Bangalore\xc2\xb7\n\n\n\n\n\n\n2.3 km'"
b'7.1 km',b'4.4 (672 Ratings)\xc2\xb7Very Good',b'\xe2\x82\xb9903\xe2\x82\xb9',"b'Near Champion InfoMetrics Pvt Ltd, Sector 6, Bangalore\xc2\xb7\n\n\n\n\n\n\n7.1 km'"
b'2.6 km',b'NEW',b'\xe2\x82\xb9952\xe2\x82\xb9',"b'bangalore 560027India, Bangalore\xc2\xb7\n\n\n\n\n\n\n2.6 km'"
b'8.3 km',b'4.1 (777 Ratings)\xc2\xb7Very Good',b'\xe2\x82\xb91216',"b'Near Nagavara Junction, HBR Layout 5th Block, Bangalore\xc2\xb7\n\n\n\n\n\n\n8.3 km'"
b'6.1 km',b'4.3 (91 Ratings)\xc2\xb7Very Good',b'\xe2\x82\xb91369',"b'Near Vijayanagar police station, MC Layout, Bangalore\xc2\xb7\n\n\n\n\n\n\n6.1 km'"
b'1.4 km',b'4.4 (548 Ratings)\xc2\xb7Very Good',b'\xe2\x82\xb91014',"b'Near Shivajinagar Bus Stand, Tasker Town, Bangalore\xc2\xb7\n\n\n\n\n\n\n1.4 km'"
b'1.4 km',b'4.0 (329 Ratings)\xc2\xb7Very Good',b'\xe2\x82\xb9987\xe2\x82\xb9',"b'Cubbonpet Main Road, Bangalore\xc2\xb7\n\n\n\n\n\n\n1.4 km'"
b'8.9 km',b'4.3 (196 Ratings)\xc2\xb7Very Good',b'\xe2\x82\xb91593',"b'Near Vijayalakshmi Hospital, Kalyan Nagar, Bangalore\xc2\xb7\n\n\n\n\n\n\n8.9 km'"
b'7.6 km',b'4.1 (444 Ratings)\xc2\xb7Very Good',b'\xe2\x82\xb9934\xe2\x82\xb9',"b'Near Kalyan Nagar Bus Stand, 1st stage, Bangalore\xc2\xb7\n\n\n\n\n\n\n7.6 km'"
b'4.4 km',b'4.2 (58 Ratings)\xc2\xb7Very Good',b'\xe2\x82\xb91216',"b'Karnataka, Bangalore\xc2\xb7\n\n\n\n\n\n\n4.4 km'"
b'6.3 km',b'NEW',b'\xe2\x82\xb91369',"b'Near S T Bed, Koramangala 1st Block, Bangalore\xc2\xb7\n\n\n\n\n\n\n6.3 km'"
b'7.2 km',b'4.6 (474 Ratings)\xc2\xb7Excellent',b'\xe2\x82\xb91882',"b'Mathikere, Bangalore\xc2\xb7\n\n\n\n\n\n\n7.2 km'"
b'2.0 km',b'4.3 (402 Ratings)\xc2\xb7Very Good',b'\xe2\x82\xb9954\xe2\x82\xb9',"b'Near Minerva Circle, JC Road, Bangalore\xc2\xb7\n\n\n\n\n\n\n2.0 km'"
b'3.6 km',b'NEW',b'\xe2\x82\xb91833',"b'MALLESHWARAM, Bangalore\xc2\xb7\n\n\n\n\n\n\n3.6 km'"
b'1.8 km',b'3.9 (125 Ratings)\xc2\xb7Good',b'\xe2\x82\xb91216',"b'Near Freedom Park, Gandhinagar, Bangalore\xc2\xb7\n\n\n\n\n\n\n1.8 km'"
b'6.7 km',b'3.7 (313 Ratings)\xc2\xb7Good',b'\xe2\x82\xb91014',"b'Near Bus Stand, Murugeshpalya, Bangalore\xc2\xb7\n\n\n\n\n\n\n6.7 km'"
b'7.9 km',b'NEW',b'\xe2\x82\xb91014',"b'India, Bangalore\xc2\xb7\n\n\n\n\n\n\n7.9 km'"
b'8.5 km',b'NEW',b'\xe2\x82\xb9901\xe2\x82\xb9',"b'Near N R Colony, Sajjepalya, Bangalore\xc2\xb7\n\n\n\n\n\n\n8.5 km'"
b'7.1 km',b'3.6 (233 Ratings)\xc2\xb7Good',b'\xe2\x82\xb9814\xe2\x82\xb9',"b'Near Railway Hospital, Yeswanthpur, Bangalore\xc2\xb7\n\n\n\n\n\n\n7.1 km'"
b'2.6 km',b'4.2 (39 Ratings)\xc2\xb7Very Good',b'\xe2\x82\xb9805\xe2\x82\xb9',"b'Near City Library, Akkipete, Bangalore\xc2\xb7\n\n\n\n\n\n\n2.6 km'"
b'7.2 km',b'4.2 (31 Ratings)\xc2\xb7Very Good',b'\xe2\x82\xb91653',"b'East Zone, Bangalore\xc2\xb7\n\n\n\n\n\n\n7.2 km'"
b'5.6 km',b'4.7 (709 Ratings)\xc2\xb7Excellent',b'\xe2\x82\xb91964',"b'12TH MAIN RD,HAL 2ND STAGE ,INDIRANAGAR,BANGALORE\xc2\xb7\n\n\n\n\n\n\n5.6 km'"
b'6.8 km',b'4.2 (933 Ratings)\xc2\xb7Very Good',b'\xe2\x82\xb91014',"b'Near Central Silk board, BTM Layout, Bangalore\xc2\xb7\n\n\n\n\n\n\n6.8 km'"
b'8.3 km',b'4.5 (117 Ratings)\xc2\xb7Excellent',b'\xe2\x82\xb91369',"b'OPP TO IIM MAIN GATE, BILEKAHALLI\xc2\xb7\n\n\n\n\n\n\n8.3 km'"
b'5.4 km',b'4.2 (737 Ratings)\xc2\xb7Very Good',b'\xe2\x82\xb9958\xe2\x82\xb9',"b'Near TATA Motors, Serenity Layout, Bangalore\xc2\xb7\n\n\n\n\n\n\n5.4 km'"
b'8.4 km',b'4.4 (309 Ratings)\xc2\xb7Very Good',b'\xe2\x82\xb9844\xe2\x82\xb9',"b'Near Laggere bridge, Narasimhaswamy Layout, Bangalore\xc2\xb7\n\n\n\n\n\n\n8.4 km'"
b'2.6 km',b'4.2 (39 Ratings)\xc2\xb7Very Good',b'\xe2\x82\xb9805\xe2\x82\xb9',"b'Near City Library, Akkipete, Bangalore\xc2\xb7\n\n\n\n\n\n\n2.6 km'"
b'6.2 km',b'4.0 (672 Ratings)\xc2\xb7Very Good',b'\xe2\x82\xb91014',"b'Near Jayadeva Flyover, BTM Layout, Bangalore\xc2\xb7\n\n\n\n\n\n\n6.2 km'"
b'6.8 km',b'3.8 (39 Ratings)\xc2\xb7Good',b'\xe2\x82\xb91007',"b'Near Kemp Fort , Murugeshpalya, Bangalore\xc2\xb7\n\n\n\n\n\n\n6.8 km'"
b'5.4 km',b'4.2 (339 Ratings)\xc2\xb7Very Good',b'\xe2\x82\xb91753',"b'West Of Chord Road, Shivajinagar, Bangalore\xc2\xb7\n\n\n\n\n\n\n5.4 km'"
b'2.4 km',b'3.8 (520 Ratings)\xc2\xb7Good',b'\xe2\x82\xb91216',"b'Near Adams Creation, Victoria Layout, Bangalore\xc2\xb7\n\n\n\n\n\n\n2.4 km'"
b'7.8 km',b'4.7 (686 Ratings)\xc2\xb7Excellent',b'\xe2\x82\xb9902\xe2\x82\xb9',"b'Near Sri Ganapathi Temple, KR Layout, Bangalore\xc2\xb7\n\n\n\n\n\n\n7.8 km'"
b'5.8 km',b'4.0 (601 Ratings)\xc2\xb7Very Good',b'\xe2\x82\xb9994\xe2\x82\xb9',"b'Near Maharaja Signal, Kormangala, Bangalore\xc2\xb7\n\n\n\n\n\n\n5.8 km'"
b'8.9 km',b'4.1 (142 Ratings)\xc2\xb7Very Good',b'\xe2\x82\xb91930',"b'Near Narayana Hospital, HSR Layout, Bangalore\xc2\xb7\n\n\n\n\n\n\n8.9 km'"
b'1.9 km',b'NEW',b'\xe2\x82\xb91599',"b'Near SBBJ Bank, Gandhinagar, Bangalore\xc2\xb7\n\n\n\n\n\n\n1.9 km'"
b'2.9 km',b'4.5 (45 Ratings)\xc2\xb7Excellent',b'\xe2\x82\xb91216',"b'Railway Colony Majestic , Bangalore\xc2\xb7\n\n\n\n\n\n\n2.9 km'"
b'6.7 km',b'4.3 (1218 Ratings)\xc2\xb7Very Good',b'\xe2\x82\xb91604',"b'Near gopalan cinemas, J.P. Nagar, Bangalore\xc2\xb7\n\n\n\n\n\n\n6.7 km'"
b'3.6 km',b'NEW',b'\xe2\x82\xb91219',"b'Halasuru, Bangalore\xc2\xb7\n\n\n\n\n\n\n3.6 km'"
b'1.9 km',b'4.2 (424 Ratings)\xc2\xb7Very Good',b'\xe2\x82\xb91594',"b'Near Gandhi Nagar Park, Gandhinagar, Banglore\xc2\xb7\n\n\n\n\n\n\n1.9 km'"
b'6.9 km',b'NEW',b'\xe2\x82\xb91247',"b'India, Bangalore\xc2\xb7\n\n\n\n\n\n\n6.9 km'"
b'8.7 km',b'4.2 (571 Ratings)\xc2\xb7Very Good',b'\xe2\x82\xb9914\xe2\x82\xb9',"b'Near Lumbini Garden, Kempapur, Bangalore\xc2\xb7\n\n\n\n\n\n\n8.7 km'"
b'7.3 km',b'4.0 (315 Ratings)\xc2\xb7Very Good',b'\xe2\x82\xb9702\xe2\x82\xb9',"b'Near Msrit, Mathikere Extension, Bangalore\xc2\xb7\n\n\n\n\n\n\n7.3 km'"
b'6.1 km',b'4.0 (590 Ratings)\xc2\xb7Very Good',b'\xe2\x82\xb91014',"b'Near Total mall, Old Madiwala, Bangalore\xc2\xb7\n\n\n\n\n\n\n6.1 km'"
b'5.9 km',b'NEW',b'\xe2\x82\xb92413',"b'Near Kaveri Speciality Hospital, Madiwala, Bangalore\xc2\xb7\n\n\n\n\n\n\n5.9 km'"
b'2.1 km',b'3.8 (381 Ratings)\xc2\xb7Good',b'\xe2\x82\xb91216',"b'Near Vijayalaxmi theater, Chickpet, Bangalore\xc2\xb7\n\n\n\n\n\n\n2.1 km'"
b'7.6 km',b'4.2 (854 Ratings)\xc2\xb7Very Good',b'\xe2\x82\xb9872\xe2\x82\xb9',"b'Dodda Banasawadi Main Rd, Kalyan Nagar, Bangalore\xc2\xb7\n\n\n\n\n\n\n7.6 km'"
b'9.9 km',b'3.7 (48 Ratings)\xc2\xb7Good',b'\xe2\x82\xb91286',"b'Near SATELLITE BUSTAND, Gnanabharathi, Bangalore\xc2\xb7\n\n\n\n\n\n\n9.9 km'"
b'2.6 km',b'4.8 (282 Ratings)\xc2\xb7Excellent',b'\xe2\x82\xb9904\xe2\x82\xb9',"b'Near Majestic Railway Station, Akkipete, Bangalore\xc2\xb7\n\n\n\n\n\n\n2.6 km'"
b'9.8 km',b'4.4 (196 Ratings)\xc2\xb7Very Good',b'\xe2\x82\xb91373',"b'Near Manyata Tech Park, Byatarayanapura, Bangalore\xc2\xb7\n\n\n\n\n\n\n9.8 km'"
b'2.7 km',b'4.6 (586 Ratings)\xc2\xb7Excellent',b'\xe2\x82\xb9958\xe2\x82\xb9',"b'Near 140 Cottonpet Main road, Majestic, Bangalore\xc2\xb7\n\n\n\n\n\n\n2.7 km'"
b'7.2 km',b'5.0 (408 Ratings)\xc2\xb7Fabulous',b'\xe2\x82\xb91267',"b'Near Om Shakti Temple, Kalyan Nagar, Bangalore\xc2\xb7\n\n\n\n\n\n\n7.2 km'"
b'5.8 km',b'NEW',b'\xe2\x82\xb91498',"b'India, Bangalore\xc2\xb7\n\n\n\n\n\n\n5.8 km'"
b'5.5 km',b'4.0 (2388 Ratings)\xc2\xb7Very Good',b'\xe2\x82\xb91654',"b'Near Forum Mall, Koramangala, Bangalore\xc2\xb7\n\n\n\n\n\n\n5.5 km'"
b'3.0 km',b'3.9 (258 Ratings)\xc2\xb7Good',b'\xe2\x82\xb9855\xe2\x82\xb9',"b'Near Brand factory, Someshwara Nagar, Bangalore\xc2\xb7\n\n\n\n\n\n\n3.0 km'"
b'4.2 km',b'4.2 (301 Ratings)\xc2\xb7Very Good',b'\xe2\x82\xb9906\xe2\x82\xb9',"b'Near Bus stop, Basavanagudi, Bangalore\xc2\xb7\n\n\n\n\n\n\n4.2 km'"
b'5.3 km',b'NEW',b'\xe2\x82\xb91452',"b'Bangalore, Bangalore\xc2\xb7\n\n\n\n\n\n\n5.3 km'"
b'7.9 km',b'4.6 (665 Ratings)\xc2\xb7Excellent',b'\xe2\x82\xb9877\xe2\x82\xb9',"b'Sundar Ram Shetty Nagar, Bannerghatta, Bangalore\xc2\xb7\n\n\n\n\n\n\n7.9 km'"
b'5.2 km',b'4.1 (233 Ratings)\xc2\xb7Very Good',b'\xe2\x82\xb91669',"b'Near Domlur Flyover Junction, ISRO Colony, Bangalore\xc2\xb7\n\n\n\n\n\n\n5.2 km'"
b'5.1 km',b'4.7 (208 Ratings)\xc2\xb7Excellent',b'\xe2\x82\xb91750',"b'Near Metro Station, Indira Nagar, Bangalore\xc2\xb7\n\n\n\n\n\n\n5.1 km'"
b'5.7 km',b'4.2 (444 Ratings)\xc2\xb7Very Good',b'\xe2\x82\xb91264',"b'Near Bharat Co-Operative Bank, Indranagar, Bangalore\xc2\xb7\n\n\n\n\n\n\n5.7 km'"
b'5.1 km',b'4.2 (462 Ratings)\xc2\xb7Very Good',b'\xe2\x82\xb91651',"b'Near koramangala club, Maistripalaya, Bangalore\xc2\xb7\n\n\n\n\n\n\n5.1 km'"
b'4.8 km',b'4.3 (1030 Ratings)\xc2\xb7Very Good',b'\xe2\x82\xb9962\xe2\x82\xb9',"b'Near Sagar Hospital, Bannerughatta, Bangalore\xc2\xb7\n\n\n\n\n\n\n4.8 km'"
b'2.5 km',b'4.4 (312 Ratings)\xc2\xb7Very Good',b'\xe2\x82\xb91014',"b'Mavalli, Bengaluru\xc2\xb7\n\n\n\n\n\n\n2.5 km'"
b'2.2 km',b'NEW',b'\xe2\x82\xb91216',"b'Annama Temple Extn.Gandhingar, Bangalore\xc2\xb7\n\n\n\n\n\n\n2.2 km'"
b'7.7 km',b'4.6 (35 Ratings)\xc2\xb7Excellent',b'\xe2\x82\xb9835\xe2\x82\xb9',"b'India, Bangalore\xc2\xb7\n\n\n\n\n\n\n7.7 km'"
b'1.8 km',b'4.7 (313 Ratings)\xc2\xb7Excellent',b'\xe2\x82\xb91572',"b'Near Corporation bank, Tasker Town, Bangalore\xc2\xb7\n\n\n\n\n\n\n1.8 km'"
b'2.5 km',b'NEW',b'\xe2\x82\xb9872\xe2\x82\xb9',"b'India, Bangalore\xc2\xb7\n\n\n\n\n\n\n2.5 km'"
b'5.0 km',b'4.7 (734 Ratings)\xc2\xb7Excellent',b'\xe2\x82\xb91216',"b'Near Ejipura Bus stand, Ashwini Layout, Bangalore\xc2\xb7\n\n\n\n\n\n\n5.0 km'"
b'3.5 km',b'4.6 (987 Ratings)\xc2\xb7Excellent',b'\xe2\x82\xb92330',"b'Near Bsnl Office, Emerald Residency, Bangalore\xc2\xb7\n\n\n\n\n\n\n3.5 km'"
b'1.0 km',b'4.7 (323 Ratings)\xc2\xb7Excellent',b'\xe2\x82\xb91457',"b'Near Baldwin Women College, Richmond Town, Bengaluru\xc2\xb7\n\n\n\n\n\n\n1.0 km'"
b'1.9 km',b'5.0 (1 Ratings)\xc2\xb7Fabulous',b'\xe2\x82\xb91484',"b'Near Freedom Park, Gandhi Nagar, Bangalore\xc2\xb7\n\n\n\n\n\n\n1.9 km'"
b'2.1 km',b'4.5 (62 Ratings)\xc2\xb7Excellent',b'\xe2\x82\xb9792\xe2\x82\xb9',"b'Near Sln Complex, Bangalore\xc2\xb7\n\n\n\n\n\n\n2.1 km'"
b'2.1 km',b'4.0 (245 Ratings)\xc2\xb7Very Good',b'\xe2\x82\xb9508\xe2\x82\xb9',"b'Near metro, Chickpet, Bangalore\xc2\xb7\n\n\n\n\n\n\n2.1 km'"
b'6.7 km',b'3.9 (227 Ratings)\xc2\xb7Good',b'\xe2\x82\xb91658',"b'Near Banaswadi Fire Station, Subrna Paliya, Bangalore\xc2\xb7\n\n\n\n\n\n\n6.7 km'"
b'8.4 km',b'4.0 (60 Ratings)\xc2\xb7Very Good',b'\xe2\x82\xb9920\xe2\x82\xb9',"b'Prakruthi Layout, Bangalore\xc2\xb7\n\n\n\n\n\n\n8.4 km'"
b'5.6 km',b'3.8 (723 Ratings)\xc2\xb7Good',b'\xe2\x82\xb91014',"b'Near 1st Stage, BTM Layout, Bangalore\xc2\xb7\n\n\n\n\n\n\n5.6 km'"
b'1.8 km',b'4.5 (136 Ratings)\xc2\xb7Excellent',b'\xe2\x82\xb91254',"b'Near Corporation High School, Gandhi Nagar, Bangalore\xc2\xb7\n\n\n\n\n\n\n1.8 km'"
b'6.3 km',b'4.6 (1884 Ratings)\xc2\xb7Excellent',b'\xe2\x82\xb91222',"b'Near A D Halli Park, Housing Board, Bangalore\xc2\xb7\n\n\n\n\n\n\n6.3 km'"
b'8.1 km',b'4.4 (878 Ratings)\xc2\xb7Very Good',b'\xe2\x82\xb91276',"b'Near Kanaka Nagar, Nagavara, Bangalore\xc2\xb7\n\n\n\n\n\n\n8.1 km'"
b'8.8 km',b'4.5 (686 Ratings)\xc2\xb7Excellent',b'\xe2\x82\xb91216',"b'Near Tin Factory Bus Stop, 1St Cross Rd, Bangalore\xc2\xb7\n\n\n\n\n\n\n8.8 km'"
b'7.6 km',b'4.7 (1175 Ratings)\xc2\xb7Excellent',b'\xe2\x82\xb91216',"b'Near Udupi Upachar, Lakshmamma Layout, Bangalore\xc2\xb7\n\n\n\n\n\n\n7.6 km'"
b'9.2 km',b'3.9 (284 Ratings)\xc2\xb7Good',b'\xe2\x82\xb91362',"b'Near Bel Circle, Gokul Mattikere, Bangalore\xc2\xb7\n\n\n\n\n\n\n9.2 km'"
b'2.3 km',b'4.7 (431 Ratings)\xc2\xb7Excellent',b'\xe2\x82\xb91776',"b'Near Manipal Centre, Ulsoor Road, Bangalore\xc2\xb7\n\n\n\n\n\n\n2.3 km'"
b'2.0 km',b'3.5 (878 Ratings)\xc2\xb7Good',b'\xe2\x82\xb91387',"b'Near HKP Road, Shivaji Nagar, Bangalore\xc2\xb7\n\n\n\n\n\n\n2.0 km'"
b'5.5 km',b'NEW',b'\xe2\x82\xb91014',"b'Near SV Hospital, BTM Layout, Bangalore\xc2\xb7\n\n\n\n\n\n\n5.5 km'"
b'5.7 km',b'4.1 (959 Ratings)\xc2\xb7Very Good',b'\xe2\x82\xb91216',"b'Near Cross Road, Maruti Nagar, Bangalore\xc2\xb7\n\n\n\n\n\n\n5.7 km'"
b'2.2 km',b'NEW',b'\xe2\x82\xb91510',"b'560001, Bangalore\xc2\xb7\n\n\n\n\n\n\n2.2 km'"
b'7.5 km',b'4.5 (50 Ratings)\xc2\xb7Excellent',b'\xe2\x82\xb91744',"b'West Zone, Bangalore\xc2\xb7\n\n\n\n\n\n\n7.5 km'"
b'5.2 km',b'3.8 (193 Ratings)\xc2\xb7Good',b'\xe2\x82\xb91807',"b'Near Dhobi Ghat junction, Rajajinagar, Bangalore\xc2\xb7\n\n\n\n\n\n\n5.2 km'"
b'8.8 km',b'4.5 (194 Ratings)\xc2\xb7Excellent',b'\xe2\x82\xb91887',"b'Near, Narayana Hospital, Hsr Layout, Bangalore\xc2\xb7\n\n\n\n\n\n\n8.8 km'"
b'7.9 km',b'4.3 (262 Ratings)\xc2\xb7Very Good',b'\xe2\x82\xb9952\xe2\x82\xb9',"b'Sundar Ram Shetty Nagar, Bilekahalli, Bannerghatta\xc2\xb7\n\n\n\n\n\n\n7.9 km'"
b'2.1 km',b'3.9 (270 Ratings)\xc2\xb7Good',b'\xe2\x82\xb91014',"b'Near Jumma masjid, Shivaji Nagar, Bangalore\xc2\xb7\n\n\n\n\n\n\n2.1 km'"
b'6.6 km',b'3.8 (240 Ratings)\xc2\xb7Good',b'\xe2\x82\xb91216',"b'Near Airforce School, Murgesh Pallya, Bangalore\xc2\xb7\n\n\n\n\n\n\n6.6 km'"
b'5.5 km',b'4.0 (520 Ratings)\xc2\xb7Very Good',b'\xe2\x82\xb91269',"b'Near Dell Office, Inner Ring Road, Bangalore\xc2\xb7\n\n\n\n\n\n\n5.5 km'"
b'3.4 km',b'4.1 (114 Ratings)\xc2\xb7Very Good',b'\xe2\x82\xb91351',"b'Halasuru, Bangalore\xc2\xb7\n\n\n\n\n\n\n3.4 km'"
b'1.6 km',b'NEW',b'\xe2\x82\xb91216',"b'Nagarathpete, Bangalore\xc2\xb7\n\n\n\n\n\n\n1.6 km'"
b'7.1 km',b'4.5 (1077 Ratings)\xc2\xb7Excellent',b'\xe2\x82\xb91233',"b'Near V.E.T School, J.P. Nagar, Bangalore\xc2\xb7\n\n\n\n\n\n\n7.1 km'"
b'2.0 km',b'4.6 (1508 Ratings)\xc2\xb7Excellent',b'\xe2\x82\xb9766\xe2\x82\xb9',"b'Near Majestic Railway station, Lalbagh, Bangalore\xc2\xb7\n\n\n\n\n\n\n2.0 km'"
b'6.0 km',b'3.9 (614 Ratings)\xc2\xb7Good',b'\xe2\x82\xb91656',"b'Near, HMT Layout Bus Stop, R.T.Nagar, Bangalore\xc2\xb7\n\n\n\n\n\n\n6.0 km'"
b'6.9 km',b'3.9 (582 Ratings)\xc2\xb7Good',b'\xe2\x82\xb91513',"b'Near Banashankri Metro Station, JP Nagar, Bangalore\xc2\xb7\n\n\n\n\n\n\n6.9 km'"
b'5.7 km',b'4.1 (112 Ratings)\xc2\xb7Very Good',b'\xe2\x82\xb91232',"b'Near Savoury Sea Shell, HSR Layout Sector 2, Bangalore\xc2\xb7\n\n\n\n\n\n\n5.7 km'"
b'2.1 km',b'4.5 (144 Ratings)\xc2\xb7Excellent',b'\xe2\x82\xb91562',"b'Near Lalbagh, Doddamavalli, Bangalore\xc2\xb7\n\n\n\n\n\n\n2.1 km'"
b'2.8 km',b'4.6 (1780 Ratings)\xc2\xb7Excellent',b'\xe2\x82\xb9660\xe2\x82\xb9',"b'Near TCM Royan Road, Sevashrama, Bangalore\xc2\xb7\n\n\n\n\n\n\n2.8 km'"
b'8.2 km',b'4.6 (216 Ratings)\xc2\xb7Excellent',b'\xe2\x82\xb91216',"b'Chandra Layout Extension II Stage, Nayanda Halli, Bengaluru\xc2\xb7\n\n\n\n\n\n\n8.2 km'"
b'5.5 km',b'4.4 (1625 Ratings)\xc2\xb7Very Good',b'\xe2\x82\xb91014',"b'Near Srinivasa Temple Road, Maruti Nagar, Bangalore\xc2\xb7\n\n\n\n\n\n\n5.5 km'"
b'4.8 km',b'4.3 (310 Ratings)\xc2\xb7Very Good',b'\xe2\x82\xb91375',"b'Near Sagar Hospital, Tilak Nagar, Bangalore\xc2\xb7\n\n\n\n\n\n\n4.8 km'"
b'2.4 km',b'4.1 (941 Ratings)\xc2\xb7Very Good',b'\xe2\x82\xb91474',"b'Near Sulthangunta, Shivaji Nagar, Bangalore \xc2\xb7\n\n\n\n\n\n\n2.4 km'"
b'3.9 km',b'4.6 (1100 Ratings)\xc2\xb7Excellent',b'\xe2\x82\xb91014',"b'Near Gandhi Bazaar, Main Road, Bangalore\xc2\xb7\n\n\n\n\n\n\n3.9 km'"
b'9.3 km',b'4.5 (576 Ratings)\xc2\xb7Excellent',b'\xe2\x82\xb91849',"b'Near Polar Bear, Nagarbhavi, Bangalore\xc2\xb7\n\n\n\n\n\n\n9.3 km'"
b'2.1 km',b'4.6 (359 Ratings)\xc2\xb7Excellent',b'\xe2\x82\xb91014',"b""Near St.Philomena's Hospital, Xavier Layout, Bangalore\xc2\xb7\n\n\n\n\n\n\n2.1 km"""
b'6.6 km',b'4.0 (301 Ratings)\xc2\xb7Very Good',b'\xe2\x82\xb91014',"b'Near manyata tech park, Kammanahalli, Bangalore\xc2\xb7\n\n\n\n\n\n\n6.6 km'"
b'4.6 km',b'4.2 (822 Ratings)\xc2\xb7Very Good',b'\xe2\x82\xb91294',"b'Near Bajaj Showroom, Prakash Nagar, Bangalore\xc2\xb7\n\n\n\n\n\n\n4.6 km'"
b'8.1 km',b'NEW',b'\xe2\x82\xb91216',"b'Kammanahalli Bangalore, Bangalore\xc2\xb7\n\n\n\n\n\n\n8.1 km'"
b'8.4 km',b'4.6 (1867 Ratings)\xc2\xb7Excellent',b'\xe2\x82\xb91336',"b'Near Emid Bommanahalli, Hosur Main Road, Bangalore\xc2\xb7\n\n\n\n\n\n\n8.4 km'"
b'8.0 km',b'4.1 (665 Ratings)\xc2\xb7Very Good',b'\xe2\x82\xb9760\xe2\x82\xb9',"b'Near manyata tech park, Nagavara, Bangalore\xc2\xb7\n\n\n\n\n\n\n8.0 km'"
b'9.0 km',b'4.7 (1025 Ratings)\xc2\xb7Excellent',b'\xe2\x82\xb9872\xe2\x82\xb9',"b'Near Shree Lakshmi Theatre, Govindpura, Bangalore\xc2\xb7\n\n\n\n\n\n\n9.0 km'"
b'4.6 km',b'4.5 (42 Ratings)\xc2\xb7Excellent',b'\xe2\x82\xb91249',"b'Bhuvanappa Layout, Bangalore\xc2\xb7\n\n\n\n\n\n\n4.6 km'"
b'7.0 km',b'4.4 (1375 Ratings)\xc2\xb7Very Good',b'\xe2\x82\xb91390',"b'Near Bus tsop, Gururaja Layout, Bangalore\xc2\xb7\n\n\n\n\n\n\n7.0 km'"
b'9.4 km',b'4.9 (705 Ratings)\xc2\xb7Fabulous',b'\xe2\x82\xb91492',"b'Near Iblur Lake,Sarjapur Marathalli Outer Ring Road Junction, Bangalore\xc2\xb7\n\n\n\n\n\n\n9.4 km'"
b'7.4 km',b'NEW',b'\xe2\x82\xb91014',"b'Near Central Silk board, Sector 6, Bangalore\xc2\xb7\n\n\n\n\n\n\n7.4 km'"
b'9.6 km',b'3.5 (537 Ratings)\xc2\xb7Good',b'\xe2\x82\xb91449',"b'Near Uttarahalli Water Tank, Kodipur, Bangalore\xc2\xb7\n\n\n\n\n\n\n9.6 km'"
