b'9.0 km',b'4.4 (1037 Ratings)\xc2\xb7Very Good',b'\xe2\x82\xb91627',"b'Near Shanti Niketan School, Maruthinagar, Bangalore\xc2\xb7\n\n\n\n\n\n\n9.0 km'"
b'5.7 km',b'4.2 (619 Ratings)\xc2\xb7Very Good',b'\xe2\x82\xb9874\xe2\x82\xb9',"b'Agrahara Dasarahalli, Rajaji Nagar, Bangalore\xc2\xb7\n\n\n\n\n\n\n5.7 km'"
b'2.3 km',b'4.8 (495 Ratings)\xc2\xb7Excellent',b'\xe2\x82\xb91239',"b'Near Race Course, 6th A Cross, Bangalore\xc2\xb7\n\n\n\n\n\n\n2.3 km'"
b'6.0 km',b'4.2 (331 Ratings)\xc2\xb7Very Good',b'\xe2\x82\xb91570',"b'Near bus stand, Kodihalli, Bangalore\xc2\xb7\n\n\n\n\n\n\n6.0 km'"
b'8.0 km',b'4.1 (231 Ratings)\xc2\xb7Very Good',b'\xe2\x82\xb91351',"b'Next to Cafe Coffee Day, HBR Layout, Bangalore\xc2\xb7\n\n\n\n\n\n\n8.0 km'"
b'8.0 km',b'3.6 (322 Ratings)\xc2\xb7Good',b'\xe2\x82\xb91271',"b'Near 4th block, HBR Layout, Bangalore\xc2\xb7\n\n\n\n\n\n\n8.0 km'"
b'5.2 km',b'4.2 (677 Ratings)\xc2\xb7Very Good',b'\xe2\x82\xb91222',"b'Near 1st Stage, Domlur, Bangalore\xc2\xb7\n\n\n\n\n\n\n5.2 km'"
b'8.8 km',b'4.3 (615 Ratings)\xc2\xb7Very Good',b'\xe2\x82\xb91490',"b'Near HSR Club, Kadalda Meen, Bangalore\xc2\xb7\n\n\n\n\n\n\n8.8 km'"
b'5.0 km',b'4.2 (849 Ratings)\xc2\xb7Very Good',b'\xe2\x82\xb91525',"b'Near Sony Centre, Indiranagar, Bangalore\xc2\xb7\n\n\n\n\n\n\n5.0 km'"
b'8.6 km',b'4.5 (999 Ratings)\xc2\xb7Excellent',b'\xe2\x82\xb91220',"b'Near Ramamurthy Nagar Signal, Bangalore,Karnataka\xc2\xb7\n\n\n\n\n\n\n8.6 km'"
b'2.6 km',b'4.0 (677 Ratings)\xc2\xb7Very Good',b'\xe2\x82\xb91666',"b'Near INOX Lido Mall, Ulsoor, Bangalore\xc2\xb7\n\n\n\n\n\n\n2.6 km'"
b'3.8 km',b'4.3 (299 Ratings)\xc2\xb7Very Good',b'\xe2\x82\xb91652',"b'Near Halasuru Metro Station, Ulsoor, Bangalore\xc2\xb7\n\n\n\n\n\n\n3.8 km'"
b'8.5 km',b'4.0 (555 Ratings)\xc2\xb7Very Good',b'\xe2\x82\xb91386',"b'Near Nagavara, Ashwath Nagar, Bangalore\xc2\xb7\n\n\n\n\n\n\n8.5 km'"
b'2.2 km',b'3.8 (133 Ratings)\xc2\xb7Good',b'\xe2\x82\xb91014',"b'Near Kapali Theatre, Kapali Theatre, Bangalore\xc2\xb7\n\n\n\n\n\n\n2.2 km'"
b'5.5 km',b'NEW',b'\xe2\x82\xb91363',"b'Near satellite bus stand, New Guddadahalli, Bangalore\xc2\xb7\n\n\n\n\n\n\n5.5 km'"
b'0.5 km',b'4.7 (377 Ratings)\xc2\xb7Excellent',b'\xe2\x82\xb91521',"b'Near Richmond Circle, Opp ITC Gardenia\xc2\xb7\n\n\n\n\n\n\n0.5 km'"
b'7.3 km',b'4.4 (59 Ratings)\xc2\xb7Very Good',b'\xe2\x82\xb91690',"b'Padmanabha Nagar, Bangalore\xc2\xb7\n\n\n\n\n\n\n7.3 km'"
b'6.9 km',b'3.9 (340 Ratings)\xc2\xb7Good',b'\xe2\x82\xb9580\xe2\x82\xb9',"b'Near RTO Office, Yeshwanthpur, Bangalore\xc2\xb7\n\n\n\n\n\n\n6.9 km'"
b'7.8 km',b'4.3 (1975 Ratings)\xc2\xb7Very Good',b'\xe2\x82\xb9872\xe2\x82\xb9',"b'Near J P Nagar, 5th Phase, Bangalore\xc2\xb7\n\n\n\n\n\n\n7.8 km'"
